ID_num,job_title,Short_description,Skills_required,Industry,Pay_grade
286,Sustainable Architecture Designer,Design environmentally friendly buildings and structures,Architecture Environmental Science Energy Systems Creative Design Project Management,Architecture,High paying
287,Telepresence Robot Operator,Control remote robots for various applications,Technical Skills Problem Solving Communication Spatial Awareness Attention to Detail,Technology,Average paying
288,Coral Reef Restoration Specialist,Rehabilitate damaged marine ecosystems,Marine Biology Environmental Science Diving Skills Project Management Problem Solving,Environmental Services,High paying
289,Space Weather Forecaster,Predict solar activity and its effects on Earth,Astronomy Data Analysis Mathematical Modeling Research Skills Communication,Space Science,High paying
290,Bioprinting Technician,Operate 3D printers that create biological tissues,Biology 3D Printing Technology Medical Knowledge Attention to Detail Innovation,Biotechnology,High paying
291,Smart City Planner,Design technology integrated urban environments,Urban Planning Technology Systems Analysis Innovation Strategic Thinking,Urban Development,High paying
292,Neuroengineering Researcher,Develop brain computer interfaces and neural devices,Neuroscience Engineering Programming Innovation Problem Solving,Science & Research,High paying
293,Cryptocurrency Mining Coordinator,Manage digital currency mining operations,Blockchain Technology Computer Hardware Energy Management Problem Solving Technical Skills,Technology,High paying
294,Vertical Farm Manager,Oversee indoor agricultural production systems,Agricultural Science Hydroponics Technology Management Environmental Control Problem Solving,Agriculture,High paying
295,Ocean Thermal Energy Specialist,Harness temperature differences in oceans for power,Marine Engineering Renewable Energy Thermodynamics Problem Solving Innovation,Renewable Energy,High paying
296,Autonomous Vehicle Tester,Test and validate self driving car systems,Automotive Technology Safety Protocols Problem Solving Attention to Detail Data Analysis,Automotive,High paying
297,Cellular Agriculture Scientist,Develop lab grown meat and dairy products,Biology Food Science Innovation Problem Solving Research Skills,Food Science,High paying
298,Digital Twin Engineer,Create virtual replicas of physical systems,Engineering Programming Data Analysis Systems Modeling Innovation,Technology,High paying
299,Space Elevator Engineer,Design transportation systems between Earth and space,Aerospace Engineering Materials Science Physics Innovation Problem Solving,Aerospace,High paying
300,Quantum Cryptography Specialist,Develop ultra secure communication systems using quantum mechanics,Quantum Physics Cryptography Programming Security Protocols Innovation,Technology,High paying
301,Atmospheric River Forecaster,Predict extreme weather patterns and flooding,Meteorology Data Analysis Mathematical Modeling Research Skills Communication,Weather Services,High paying
302,Biocement Engineer,Develop self healing concrete and construction materials,Materials Science Biology Engineering Innovation Problem Solving,Construction,High paying
303,Neural Dust Researcher,Create wireless brain monitoring systems,Neuroscience Electronics Miniaturization Innovation Problem Solving,Science & Research,High paying
304,Swarm Robotics Coordinator,Manage groups of autonomous robots working together,Robotics Programming Systems Coordination Problem Solving Innovation,Technology,High paying
305,Atmospheric Carbon Capture Specialist,Design systems to remove CO2 from the atmosphere,Environmental Engineering Chemistry Innovation Problem Solving Climate Science,Environmental Services,High paying
306,Quantum Sensor Developer,Create ultra precise measurement instruments,Quantum Physics Engineering Innovation Problem Solving Technical Skills,Technology,High paying
307,Synthetic Spider Silk Producer,Manufacture artificial spider silk for various applications,Biology Materials Science Manufacturing Innovation Problem Solving,Biotechnology,High paying
308,Asteroid Mining Planner,Design systems for extracting resources from asteroids,Aerospace Engineering Mining Engineering Space Science Innovation Strategic Planning,Aerospace,High paying
309,Metamaterial Engineer,Design materials with properties not found in nature,Materials Science Physics Engineering Innovation Problem Solving,Engineering,High paying
310,Biocomputer Programmer,Develop computing systems using biological components,Biology Programming Innovation Problem Solving Technical Skills,Biotechnology,High paying
311,Magnetic Levitation Engineer,Design transportation systems using magnetic forces,Electrical Engineering Physics Transportation Innovation Problem Solving,Transportation,High paying
312,Genetically Modified Organism Regulator,Oversee safety of modified organisms,Biology Regulatory Knowledge Risk Assessment Communication Ethical Reasoning,Government,High paying
313,Fusion Energy Researcher,Develop clean energy through nuclear fusion,Nuclear Physics Engineering Research Skills Innovation Problem Solving,Energy Research,High paying
314,Bioluminescent Lighting Designer,Create sustainable lighting using living organisms,Biology Lighting Design Innovation Environmental Science Problem Solving,Biotechnology,High paying
315,Hypersonic Flight Engineer,Design aircraft capable of extreme speeds,Aerospace Engineering Aerodynamics Innovation Problem Solving Technical Skills,Aerospace,High paying
316,Microbiome Analyst,Study beneficial bacteria in humans and environment,Microbiology Research Skills Data Analysis Laboratory Techniques Innovation,Science & Research,High paying
317,Gravity Wave Detector Operator,Monitor cosmic gravitational disturbances,Physics Data Analysis Technical Skills Attention to Detail Research Skills,Science & Research,High paying
318,Programmable Matter Engineer,Design materials that can change shape and properties,Materials Science Programming Physics Innovation Problem Solving,Engineering,High paying
319,Exoplanet Hunter,Search for planets outside our solar system,Astronomy Data Analysis Research Skills Mathematical Modeling Attention to Detail,Space Science,High paying
320,Biorefinery Process Engineer,Convert biological waste into useful products,Chemical Engineering Biology Environmental Science Innovation Problem Solving,Biotechnology,High paying
321,Telepathic Interface Developer,Create brain to brain communication systems,Neuroscience Programming Innovation Problem Solving Technical Skills,Science & Research,High paying
322,Molecular Assembler Technician,Build products atom by atom using nanotechnology,Nanotechnology Precision Manufacturing Technical Skills Innovation Problem Solving,Manufacturing,High paying
323,Terraforming Specialist,Design systems to make planets habitable for humans,Planetary Science Environmental Engineering Innovation Strategic Planning Problem Solving,Aerospace,High paying
324,Time Crystal Researcher,Study materials with repeating patterns in time,Quantum Physics Research Skills Mathematical Modeling Innovation Problem Solving,Science & Research,High paying
325,Bioharmonic Therapist,Use biological frequencies to treat medical conditions,Biology Medical Knowledge Therapeutic Techniques Innovation Problem Solving,Healthcare,High paying
326,Music Therapist,Use music interventions to address physical emotional and social needs,Empathy Musical Skills Therapeutic Techniques Active Listening Patient Care,Healthcare,Average paying
327,Digital Archivist,Preserve and organize digital cultural heritage materials,Information Science Digital Preservation Metadata Standards Organization Technical Skills,Cultural Heritage,Average paying
328,Ethical AI Auditor,Evaluate artificial intelligence systems for bias and fairness,Machine Learning Ethics Critical Thinking Problem Solving Communication,Technology,High paying
329,Wilderness Guide,Lead outdoor expeditions and teach survival skills,Outdoor Skills Safety Awareness Leadership Navigation Physical Fitness,Recreation,Average paying
330,Marine Salvage Diver,Recover sunken vessels and underwater equipment,Deep Sea Diving Technical Skills Problem Solving Risk Assessment Physical Fitness,Maritime,High paying
331,Flavor Chemist,Develop artificial and natural flavors for food products,Chemistry Sensory Analysis Innovation Research Skills Quality Control,Food Science,High paying
332,Pet Grief Counselor,Support families through loss of companion animals,Counseling Skills Empathy Communication Animal Behavior Understanding Grief Support,Animal Services,Average paying
333,Virtual Interior Designer,Create 3D interior spaces for online clients,Interior Design 3D Modeling Software Skills Creativity Communication,Design Services,Average paying
334,Bee Removal Specialist,Safely relocate bee colonies without harm,Animal Handling Safety Protocols Problem Solving Environmental Awareness Customer Service,Pest Control,Average paying
335,Sign Language Interpreter,Facilitate communication for deaf and hearing individuals,Sign Language Fluency Cultural Awareness Communication Attention to Detail Empathy,Professional Services,Average paying
336,Crime Prevention Specialist,Analyze crime patterns and develop prevention strategies,Data Analysis Criminal Justice Research Skills Communication Strategic Planning,Law Enforcement,Average paying
337,Equine Therapist,Provide therapeutic services using horses,Animal Training Therapy Techniques Empathy Physical Coordination Safety Awareness,Healthcare,Average paying
338,Digital Detox Coach,Help individuals reduce technology dependency and digital overwhelm,Counseling Skills Psychology Technology Awareness Communication Goal Setting,Wellness,Average paying
339,Fossil Preparator,Clean and prepare fossils for research and display,Manual Dexterity Scientific Knowledge Attention to Detail Patience Laboratory Skills,Science & Research,Average paying
340,Rope Access Technician,Perform maintenance on tall structures using climbing techniques,Physical Fitness Safety Protocols Problem Solving Manual Dexterity Risk Assessment,Maintenance Services,Average paying
341,Medical Scribe,Document patient encounters for healthcare providers,Medical Terminology Typing Skills Attention to Detail Communication Organization,Healthcare,Low paying
342,Urban Beekeeper,Manage bee colonies in city environments,Beekeeping Skills Urban Planning Environmental Awareness Problem Solving Seasonal Planning,Agriculture,Average paying
343,Disaster Victim Advocate,Support individuals affected by natural disasters,Crisis Counseling Communication Empathy Resource Coordination Problem Solving,Social Services,Average paying
344,Genealogy Researcher,Trace family histories and ancestral connections,Research Skills Historical Knowledge Database Management Communication Attention to Detail,Professional Services,Average paying
345,Commercial Fisherman,Harvest fish and seafood for commercial markets,Maritime Skills Physical Stamina Safety Awareness Weather Assessment Equipment Operation,Fishing,Average paying
346,Sleep Disorder Specialist,Diagnose and treat sleep related medical conditions,Medical Knowledge Patient Assessment Diagnostic Skills Communication Problem Solving,Healthcare,High paying
347,Digital Rights Advocate,Protect online privacy and digital freedoms,Legal Knowledge Technology Understanding Advocacy Skills Communication Research Skills,Legal Services,Average paying
348,Aerial Photography Pilot,Capture images and video from aircraft or drones,Aviation Skills Photography Technical Equipment Visual Composition Safety Protocols,Photography,Average paying
349,Kombucha Brewer,Ferment and produce probiotic beverages,Fermentation Science Quality Control Food Safety Creativity Problem Solving,Food Production,Average paying
350,Memory Care Specialist,Provide specialized care for dementia and Alzheimer patients,Patient Care Compassion Communication Problem Solving Medical Knowledge,Healthcare,Average paying
351,Cave Rescue Technician,Perform emergency rescues in underground environments,Technical Rescue Skills Physical Fitness Problem Solving Safety Protocols Risk Assessment,Emergency Services,Average paying
352,Digital Accessibility Consultant,Ensure websites and apps are usable by people with disabilities,Web Development Accessibility Standards Problem Solving Communication Technical Skills,Technology,Average paying
353,Butterfly Conservationist,Protect and restore butterfly habitats and populations,Entomology Environmental Science Research Skills Conservation Biology Fieldwork,Environmental Services,Average paying
354,Voice Recognition Trainer,Improve speech recognition software accuracy,Linguistics Computer Science Audio Processing Communication Technical Skills,Technology,Average paying
355,Competitive Eating Coach,Train professional competitive eaters,Nutrition Knowledge Coaching Skills Psychology Performance Analysis Safety Awareness,Sports,Low paying
356,Digital Nomad Consultant,Help remote workers optimize location independent careers,Business Consulting Technology Skills Communication Cultural Awareness Travel Planning,Consulting,Average paying
357,Soap Maker,Create artisanal soaps and personal care products,Chemistry Creativity Quality Control Safety Protocols Customer Service,Manufacturing,Low paying
358,Storm Chaser,Document severe weather phenomena for research and media,Meteorology Photography Safety Protocols Problem Solving Risk Assessment,Weather Services,Average paying
359,Candle Maker,Design and manufacture decorative and functional candles,Craftsmanship Creativity Safety Protocols Quality Control Customer Service,Manufacturing,Low paying
360,Meditation Teacher,Instruct individuals and groups in mindfulness practices,Mindfulness Training Communication Empathy Teaching Skills Stress Management,Wellness,Low paying
361,Digital Nomad Tax Advisor,Provide tax services for location independent workers,Tax Law International Regulations Communication Problem Solving Attention to Detail,Financial Services,Average paying
362,Terrarium Designer,Create miniature ecosystems in glass containers,Botany Creativity Attention to Detail Customer Service Environmental Knowledge,Design Services,Low paying
363,Sleep Study Technician,Monitor patients during overnight sleep assessments,Medical Technology Patient Care Attention to Detail Technical Equipment Problem Solving,Healthcare,Average paying
364,Urban Forager,Identify and harvest edible plants in city environments,Botany Foraging Skills Safety Awareness Environmental Knowledge Teaching Skills,Environmental Services,Low paying
365,Cord Blood Bank Coordinator,Manage collection and storage of umbilical cord blood,Medical Knowledge Organization Communication Attention to Detail Quality Control,Healthcare,Average paying
366,Sensory Deprivation Tank Operator,Maintain flotation therapy equipment and facilities,Customer Service Equipment Maintenance Safety Protocols Problem Solving Relaxation Techniques,Wellness,Low paying
367,Digital Estate Planner,Help families manage digital assets after death,Estate Planning Technology Skills Communication Problem Solving Legal Knowledge,Legal Services,Average paying
368,Mushroom Forager,Identify and harvest wild mushrooms for culinary use,Mycology Safety Protocols Foraging Skills Environmental Knowledge Risk Assessment,Food Services,Average paying
369,Color Consultant,Advise on color schemes for interior and exterior spaces,Color Theory Creativity Communication Visual Skills Customer Service,Design Services,Average paying
370,Escape Room Designer,Create puzzle based entertainment experiences,Creative Problem Solving Game Design Engineering Customer Experience Innovation,Entertainment,Average paying
371,Digital Minimalism Coach,Help people simplify their digital lives and reduce screen time,Psychology Communication Goal Setting Technology Awareness Lifestyle Coaching,Wellness,Average paying
372,Tiny House Builder,Construct small scale living spaces and mobile homes,Construction Skills Spatial Design Problem Solving Creativity Customer Service,Construction,Average paying
373,Aquarium Maintenance Specialist,Care for fish tanks and aquatic ecosystems,Aquatic Biology Water Chemistry Equipment Maintenance Customer Service Problem Solving,Pet Services,Low paying
374,Professional Organizer,Help individuals and businesses organize their spaces,Organization Skills Problem Solving Communication Customer Service Time Management,Professional Services,Average paying
375,Digital Marketing Automation Specialist,Create automated marketing campaigns and workflows,Marketing Technology Programming Analytics Creative Thinking,Marketing,High paying
376,Permaculture Designer,Design sustainable agricultural and living systems,Ecological Design Environmental Science Agriculture Problem Solving Systems Thinking,Environmental Services,Average paying
377,Home Energy Auditor,Assess residential energy efficiency and recommend improvements,Energy Systems Knowledge Problem Solving Communication Attention to Detail Technical Skills,Energy Services,Average paying
378,Pet Portrait Artist,Create artistic representations of companion animals,Artistic Skills Animal Behavior Customer Service Creativity Communication,Arts & Crafts,Low paying
379,Digital Privacy Consultant,Advise individuals and organizations on online privacy protection,Cybersecurity Legal Knowledge Communication Problem Solving Technology Skills,Technology,Average paying
380,Bereavement Photographer,Document final moments and memorial services for families,Photography Empathy Discretion Communication Artistic Skills,Photography,Average paying
381,Fermentation Specialist,Develop fermented foods and beverages for commercial production,Food Science Microbiology Quality Control Innovation Problem Solving,Food Production,Average paying
382,Digital Asset Recovery Specialist,Help retrieve lost cryptocurrency and digital files,Cybersecurity Problem Solving Attention to Detail Communication Technical Skills,Technology,High paying
383,Mushroom Cultivation Specialist,Grow exotic and medicinal mushrooms for commercial use,Mycology Agriculture Environmental Control Quality Control Problem Solving,Agriculture,Average paying
384,Virtual Reality Therapist,Use VR technology to treat phobias and mental health conditions,Psychology Technology Skills Therapeutic Techniques Empathy Innovation,Healthcare,High paying
385,Disaster Recovery Pet Rescuer,Save and care for animals during natural disasters,Animal Handling Emergency Response Physical Fitness Problem Solving Empathy,Emergency Services,Low paying
386,Digital Content Moderator,Review and filter online content for appropriateness,Attention to Detail Critical Thinking Communication Problem Solving Cultural Awareness,Technology,Low paying
387,Rare Book Restorer,Preserve and repair historical manuscripts and texts,Manual Dexterity Historical Knowledge Attention to Detail Patience Craftsmanship,Cultural Heritage,Average paying
388,Urban Sketching Instructor,Teach drawing techniques for capturing city scenes,Artistic Skills Teaching Communication Creativity Observational Skills,Arts & Culture,Low paying
389,Digital Wellness Coach,Help individuals develop healthy relationships with technology,Psychology Communication Goal Setting Technology Awareness Lifestyle Coaching,Wellness,Average paying
390,Vintage Clothing Curator,Authenticate and preserve historical garments and fashion,Fashion History Research Skills Attention to Detail Communication Textile Knowledge,Fashion,Average paying
391,Sound Bath Practitioner,Provide therapeutic sound healing sessions,Musical Skills Healing Techniques Communication Empathy Mindfulness,Wellness,Low paying
392,Edible Landscape Designer,Create gardens that produce food while maintaining aesthetic appeal,Horticulture Landscape Design Sustainability Creativity Problem Solving,Landscaping,Average paying
393,Digital Sabbath Consultant,Help individuals and organizations implement technology breaks,Psychology Communication Time Management Wellness Coaching Technology Awareness,Wellness,Average paying
394,Mushroom Identification Guide,Lead foraging expeditions and teach mushroom safety,Mycology Teaching Skills Safety Protocols Communication Environmental Knowledge,Education,Low paying
395,Virtual Event Producer,Organize and manage online conferences and gatherings,Event Planning Technology Skills Communication Problem Solving Project Management,Event Planning,Average paying
396,Pollinator Garden Designer,Create spaces that support bees butterflies and other pollinators,Ecology Horticulture Environmental Science Creativity Problem Solving,Environmental Services,Average paying
397,Digital Legacy Planner,Help people prepare their online presence for after death,Technology Planning Communication Legal Knowledge Problem Solving,Professional Services,Average paying
398,Rain Water Harvesting Specialist,Design systems to collect and utilize rainwater,Environmental Engineering Water Management Problem Solving Sustainability Planning,Environmental Services,Average paying
399,Mindful Eating Coach,Teach individuals to develop healthy relationships with food,Nutrition Psychology Communication Empathy Goal Setting,Wellness,Average paying
400,Digital Detox Retreat Leader,Organize and lead technology free wellness experiences,Event Planning Communication Leadership Wellness Coaching Outdoor Skills,Wellness,Average paying
401,Heritage Breed Livestock Conservationist,Preserve rare and endangered farm animal breeds,Animal Husbandry Conservation Biology Genetics Agriculture Problem Solving,Agriculture,Average paying
402,Online Community Manager,Build and moderate digital communities for brands and organizations,Communication Social Media Marketing Community Building Problem Solving,Marketing,Average paying
403,Greywater System Designer,Create systems to reuse household wastewater,Plumbing Engineering Environmental Science Problem Solving Sustainability Planning,Environmental Services,Average paying
404,Digital Nomad Insurance Advisor,Provide coverage solutions for location independent workers,Insurance Knowledge Travel Regulations Communication Problem Solving Risk Assessment,Insurance,Average paying
405,Seed Bank Curator,Preserve plant genetic diversity through seed collection and storage,Botany Conservation Biology Organization Research Skills Problem Solving,Environmental Services,Average paying
406,Virtual Assistant Trainer,Teach skills for remote administrative support work,Business Skills Communication Teaching Technology Skills Organization,Professional Services,Average paying
407,Sustainable Fashion Consultant,Advise on environmentally conscious clothing choices,Fashion Knowledge Environmental Awareness Communication Sustainability Problem Solving,Fashion,Average paying
408,Digital Archaeology Researcher,Use technology to study ancient civilizations and artifacts,Archaeology Technology Skills Research Methods Data Analysis Problem Solving,Cultural Heritage,High paying
409,Microgreen Farmer,Grow nutrient dense young vegetables for restaurants and markets,Agriculture Hydroponics Quality Control Customer Service Problem Solving,Agriculture,Low paying
410,Online Learning Designer,Create educational courses and training programs for digital platforms,Instructional Design Communication Technology Skills Creativity Problem Solving,Education,Average paying
411,Wetland Restoration Specialist,Rehabilitate damaged aquatic ecosystems and habitats,Environmental Science Ecology Project Management Problem Solving Research Skills,Environmental Services,Average paying
412,Digital Product Designer,Create user centered digital products and applications,User Experience Design Problem Solving Creativity Technology Skills Communication,Technology,High paying
413,Heirloom Tomato Grower,Cultivate rare and heritage varieties of tomatoes,Agriculture Horticulture Quality Control Customer Service Problem Solving,Agriculture,Low paying
414,Remote Team Building Facilitator,Organize activities to strengthen distributed teams,Communication Leadership Psychology Team Dynamics Problem Solving,Human Resources,Average paying
415,Green Roof Designer,Create living roof systems for buildings,Landscape Architecture Environmental Science Engineering Creativity Problem Solving,Architecture,Average paying
416,Digital Anthropologist,Study how technology affects human behavior and culture,Anthropology Research Skills Data Analysis Communication Critical Thinking,Social Sciences,High paying
417,Specialty Coffee Roaster,Process coffee beans to create unique flavor profiles,Food Science Sensory Analysis Quality Control Creativity Customer Service,Food Production,Average paying
418,Virtual Reality Fitness Instructor,Lead exercise classes in immersive digital environments,Fitness Training Technology Skills Communication Motivation Innovation,Fitness & Recreation,Average paying
419,Soil Health Specialist,Assess and improve agricultural soil quality,Soil Science Agriculture Environmental Science Problem Solving Research Skills,Agriculture,Average paying
420,Digital Rights Lawyer,Practice law focused on technology and online issues,Legal Knowledge Technology Understanding Communication Problem Solving Research Skills,Legal Services,High paying
421,Artisanal Ice Cream Maker,Create unique frozen desserts using traditional methods,Culinary Arts Creativity Food Safety Quality Control Customer Service,Food Production,Low paying
422,Online Course Instructor,Teach specialized subjects through digital platforms,Subject Matter Expertise Teaching Skills Communication Technology Skills Adaptability,Education,Average paying
423,Renewable Energy Sales Consultant,Sell solar panels and clean energy systems to consumers,Sales Skills Renewable Energy Knowledge Communication Problem Solving Customer Service,Sales,Average paying
