ID_num,job_title,Short_description,Skills_required,Industry,Pay_grade
424,Digital Marketing Analytics Specialist,Analyze online marketing data to optimize campaigns,Data Analysis Marketing Knowledge Problem Solving Communication Technical Skills,Marketing,High paying
425,Heritage Seed Keeper,Preserve heirloom plant varieties for future generations,Botany Conservation Genetics Agriculture Research Skills,Environmental Services,Average paying
426,Virtual Reality Game Designer,Create immersive gaming experiences and worlds,Game Design Programming Creativity Problem Solving User Experience,Gaming,High paying
427,Sustainable Building Inspector,Evaluate construction projects for environmental compliance,Building Codes Environmental Standards Attention to Detail Communication Problem Solving,Construction,Average paying
428,Digital Wellness Researcher,Study the effects of technology on human health and behavior,Research Methods Psychology Data Analysis Communication Critical Thinking,Science & Research,High paying
429,Artisanal Chocolate Maker,Craft small batch chocolates using traditional techniques,Culinary Arts Creativity Quality Control Food Safety Customer Service,Food Production,Average paying
430,Online Community Moderator,Maintain safe and productive digital discussion spaces,Communication Problem Solving Critical Thinking Conflict Resolution Attention to Detail,Technology,Low paying
431,Permeable Pavement Installer,Install eco friendly surfaces that allow water drainage,Construction Skills Environmental Science Problem Solving Safety Protocols Technical Skills,Construction,Average paying
432,Digital Asset Appraiser,Evaluate the value of cryptocurrency and digital collectibles,Financial Analysis Technology Knowledge Research Skills Communication Problem Solving,Finance,High paying
433,Specialty Tea Blender,Create unique tea combinations and flavor profiles,Culinary Arts Sensory Analysis Creativity Quality Control Customer Service,Food Production,Average paying
434,Virtual Reality Training Developer,Create immersive educational and skills training programs,Instructional Design Programming 3D Modeling Communication Innovation,Education,High paying
435,Carbon Credit Analyst,Evaluate and trade environmental impact offsets,Environmental Science Financial Analysis Research Skills Communication Problem Solving,Environmental Services,High paying
436,Digital Nomad Visa Consultant,Advise on immigration requirements for remote workers,Immigration Law Research Skills Communication Problem Solving Cultural Awareness,Legal Services,Average paying
437,Aquaponics Farmer,Grow plants and fish together in sustainable systems,Agriculture Aquaculture Systems Thinking Problem Solving Environmental Science,Agriculture,Average paying
438,Online Reputation Manager,Monitor and improve digital presence for individuals and businesses,Digital Marketing Communication Problem Solving Research Skills Strategic Thinking,Marketing,Average paying
439,Green Chemistry Researcher,Develop environmentally friendly chemical processes,Chemistry Environmental Science Research Skills Innovation Problem Solving,Science & Research,High paying
440,Digital Estate Executor,Manage digital assets and accounts after someone passes away,Legal Knowledge Technology Skills Communication Problem Solving Organization,Legal Services,Average paying
441,Botanical Illustrator,Create scientific drawings of plants and flowers,Artistic Skills Botany Attention to Detail Communication Scientific Knowledge,Arts & Sciences,Average paying
442,Virtual Reality Social Worker,Provide counseling and support through immersive technology,Social Work Technology Skills Empathy Communication Innovation,Social Services,High paying
443,Indigenous Plant Specialist,Cultivate and preserve native plant species,Botany Conservation Biology Cultural Awareness Research Skills Problem Solving,Environmental Services,Average paying
444,Digital Literacy Instructor,Teach technology skills to underserved populations,Teaching Skills Technology Knowledge Communication Patience Cultural Sensitivity,Education,Low paying
445,Sustainable Fashion Designer,Create clothing with minimal environmental impact,Fashion Design Environmental Awareness Creativity Innovation Problem Solving,Fashion,Average paying
446,Virtual Assistant Services Manager,Coordinate remote administrative support teams,Management Communication Organization Problem Solving Technology Skills,Business Services,Average paying
447,Rainforest Conservation Guide,Lead educational tours while protecting tropical ecosystems,Environmental Science Teaching Skills Communication Physical Fitness Conservation Biology,Environmental Services,Average paying
448,Digital Payment Security Analyst,Protect online financial transactions from fraud,Cybersecurity Financial Systems Problem Solving Attention to Detail Communication,Finance,High paying
449,Artisanal Bread Baker,Create traditional breads using time honored techniques,Culinary Arts Attention to Detail Quality Control Creativity Customer Service,Food Production,Average paying
450,Online Learning Support Specialist,Help students navigate digital educational platforms,Education Technology Communication Problem Solving Customer Service,Education,Low paying
451,Green Building Consultant,Advise on sustainable construction practices and materials,Architecture Environmental Science Building Codes Communication Problem Solving,Construction,High paying
452,Digital Privacy Educator,Teach individuals and organizations about online security,Cybersecurity Teaching Skills Communication Technology Knowledge Problem Solving,Education,Average paying
453,Heritage Fruit Tree Cultivator,Grow and preserve rare and antique fruit varieties,Horticulture Conservation Biology Agriculture Research Skills Problem Solving,Agriculture,Average paying
454,Virtual Reality Meditation Guide,Lead mindfulness sessions in immersive digital environments,Meditation Teaching Technology Skills Communication Mindfulness Training,Wellness,Average paying
455,Waste Stream Analyst,Study material flows to reduce environmental impact,Environmental Science Data Analysis Research Skills Problem Solving Communication,Environmental Services,Average paying
456,Digital Content Creator,Produce engaging multimedia content for online audiences,Creativity Communication Technology Skills Marketing Problem Solving,Media & Publishing,Average paying
457,Regenerative Agriculture Specialist,Implement farming practices that restore soil health,Agriculture Environmental Science Research Skills Problem Solving Systems Thinking,Agriculture,Average paying
458,Online Business Coach,Help entrepreneurs build successful digital enterprises,Business Consulting Communication Coaching Skills Problem Solving Strategic Thinking,Business Services,Average paying
459,Biochar Production Specialist,Create carbon sequestering soil amendments from organic waste,Environmental Science Chemistry Agriculture Innovation Problem Solving,Environmental Services,Average paying
460,Digital Marketing Strategist,Develop comprehensive online marketing campaigns,Marketing Strategy Communication Analytical Thinking Creativity Problem Solving,Marketing,High paying
461,Traditional Craft Instructor,Teach historical handicraft techniques and skills,Craftsmanship Teaching Skills Communication Cultural Knowledge Patience,Arts & Culture,Low paying
462,Virtual Events Technical Director,Manage technology for online conferences and gatherings,Technology Skills Problem Solving Communication Project Management Innovation,Technology,Average paying
463,Pollinator Habitat Restorer,Create and maintain spaces for bees butterflies and beneficial insects,Ecology Conservation Biology Environmental Science Problem Solving Research Skills,Environmental Services,Average paying
464,Digital Transformation Consultant,Help organizations adapt to new technologies and processes,Business Consulting Technology Strategy Communication Problem Solving Change Management,Consulting,High paying
465,Artisanal Fermented Foods Producer,Create traditional cultured foods like kimchi and sauerkraut,Food Science Fermentation Cultural Knowledge Quality Control Customer Service,Food Production,Average paying
466,Online Community Builder,Create and grow digital spaces for shared interests and goals,Community Management Communication Social Media Problem Solving Relationship Building,Technology,Average paying
467,Ecological Restoration Coordinator,Plan and oversee habitat rehabilitation projects,Environmental Science Project Management Research Skills Communication Problem Solving,Environmental Services,High paying
468,Digital Product Manager,Oversee development and launch of software products and applications,Product Management Technology Strategy Communication Problem Solving Leadership,Technology,High paying
469,Sustainable Tourism Guide,Lead eco friendly travel experiences while preserving destinations,Tourism Environmental Awareness Communication Cultural Knowledge Problem Solving,Tourism,Average paying
470,Virtual Reality Healthcare Developer,Create medical training and patient treatment applications,Healthcare Technology Programming Innovation Problem Solving,Healthcare,High paying
471,Indigenous Food Sovereignty Advocate,Promote traditional food systems and cultural preservation,Cultural Awareness Advocacy Skills Communication Research Skills Problem Solving,Social Services,Average paying
472,Digital Analytics Consultant,Help organizations understand and optimize their online performance,Data Analysis Marketing Technology Communication Problem Solving,Consulting,High paying
473,Artisanal Soap and Cosmetics Maker,Create natural personal care products using traditional methods,Chemistry Creativity Quality Control Safety Protocols Customer Service,Manufacturing,Low paying
474,Online Education Quality Assurance Specialist,Ensure digital learning programs meet educational standards,Education Quality Control Communication Problem Solving Attention to Detail,Education,Average paying
475,Climate Adaptation Planner,Help communities prepare for environmental changes,Environmental Science Urban Planning Communication Problem Solving Research Skills,Environmental Services,High paying
476,Digital Accessibility Developer,Create inclusive technology solutions for people with disabilities,Web Development Accessibility Standards Problem Solving Communication Innovation,Technology,High paying
477,Heritage Livestock Guardian,Protect and preserve rare farm animal breeds,Animal Husbandry Conservation Biology Genetics Problem Solving Research Skills,Agriculture,Average paying
478,Virtual Reality Architecture Visualizer,Create immersive previews of building designs,Architecture 3D Modeling Technology Skills Creativity Communication,Architecture,Average paying
479,Ecosystem Services Valuer,Quantify the economic benefits of natural environments,Environmental Economics Research Skills Data Analysis Communication Problem Solving,Environmental Services,High paying
480,Digital Brand Strategist,Develop online identity and positioning for organizations,Branding Marketing Strategy Communication Creativity Problem Solving,Marketing,High paying
481,Traditional Building Craft Specialist,Preserve historical construction techniques and skills,Construction Cultural Heritage Manual Dexterity Problem Solving Teaching Skills,Construction,Average paying
482,Online Learning Community Manager,Foster engagement and connection in educational platforms,Community Management Education Communication Problem Solving Technology Skills,Education,Average paying
483,Renewable Energy Project Developer,Plan and implement clean energy installations,Project Management Renewable Energy Finance Communication Problem Solving,Renewable Energy,High paying
484,Digital Employee Experience Designer,Optimize remote work environments and company culture,Human Resources Technology Skills Communication Problem Solving Psychology,Human Resources,High paying
485,Artisanal Pickle and Preserve Maker,Create traditional preserved foods using time honored methods,Food Science Food Safety Creativity Quality Control Customer Service,Food Production,Low paying
486,Virtual Reality Sports Trainer,Use immersive technology to improve athletic performance,Sports Training Technology Skills Communication Motivation Innovation,Sports,Average paying
487,Biodiversity Conservation Coordinator,Protect and restore species and habitat diversity,Conservation Biology Environmental Science Research Skills Problem Solving Communication,Environmental Services,High paying
488,Digital Marketing Automation Developer,Create systems that automate online marketing processes,Marketing Technology Programming Problem Solving Innovation,Marketing,High paying
489,Traditional Medicine Plant Cultivator,Grow herbs and plants used in historical healing practices,Botany Traditional Medicine Agriculture Research Skills Problem Solving,Agriculture,Average paying
490,Online Workshop Facilitator,Lead interactive learning sessions through digital platforms,Teaching Skills Communication Technology Skills Problem Solving Group Dynamics,Education,Average paying
491,Sustainable Water Systems Designer,Create eco friendly water treatment and distribution systems,Environmental Engineering Water Management Problem Solving Innovation Sustainability,Environmental Services,High paying
492,Digital Customer Experience Analyst,Study and improve online user interactions and satisfaction,User Experience Research Data Analysis Communication Problem Solving,Technology,High paying
493,Heritage Grain Grower and Miller,Cultivate and process ancient wheat and grain varieties,Agriculture Food Processing Traditional Skills Quality Control Problem Solving,Agriculture,Average paying
494,Virtual Reality Museum Curator,Create immersive cultural and educational experiences,Museum Studies Technology Skills Communication Creativity Research Skills,Cultural Heritage,Average paying
495,Ecological Economist,Study the relationship between economic systems and environmental health,Economics Environmental Science Research Skills Communication Problem Solving,Economics,High paying
496,Digital Wellness Program Coordinator,Develop and manage technology balance initiatives for organizations,Wellness Coaching Program Management Communication Problem Solving Psychology,Wellness,Average paying
497,Artisanal Fiber Artist and Dyer,Create textiles using traditional techniques and natural materials,Textile Arts Creativity Manual Dexterity Cultural Knowledge Customer Service,Arts & Crafts,Low paying
498,Online Course Technical Producer,Manage the technical aspects of digital educational content creation,Education Technology Video Production Problem Solving Communication,Education,Average paying
499,Climate Change Communication Specialist,Translate scientific research into accessible public information,Environmental Science Communication Research Skills Problem Solving Public Speaking,Environmental Services,Average paying
500,Digital Innovation Consultant,Help organizations adopt emerging technologies and future focused strategies,Technology Strategy Innovation Management Communication Problem Solving,Consulting,High paying
501,Machine Learning Engineer,Design and implement ML algorithms for production systems,Python; TensorFlow; Statistics; Cloud Platforms; Data Engineering,Technology,High paying
502,Cybersecurity Architect,Design comprehensive security frameworks for enterprise systems,Security Protocols; Risk Assessment; Network Security; Compliance; Leadership,Technology,High paying
503,Product Owner,Define product vision and manage development roadmap,Agile Methodologies; Stakeholder Management; Analytics; Market Research; Communication,Technology,High paying
504,Cloud Solutions Architect,Design scalable cloud infrastructure and migration strategies,AWS/Azure; Microservices; DevOps; System Design; Cost Optimization,Technology,High paying
505,AI Research Scientist,Conduct advanced research in artificial intelligence and machine learning,Deep Learning; Research Methodology; Statistical Analysis; Python; Publications,Science & Research,High paying
506,Blockchain Developer,Develop decentralized applications and smart contracts,Solidity; Web3; Cryptography; Distributed Systems; JavaScript,Technology,High paying
507,Investment Banking Analyst,Analyze financial markets and support M&A transactions,Financial Modeling; Valuation; Excel; PowerPoint; Market Analysis,Finance,High paying
508,Petroleum Engineer,Design extraction methods for oil and gas resources,Reservoir Engineering; Drilling Technology; Geology; Safety Protocols; CAD,Oil & Gas,High paying
509,Neurosurgeon,Perform complex brain and nervous system surgeries,Medical Expertise; Surgical Skills; Precision; Decision Making; Stamina,Healthcare,High paying
510,Aerospace Engineer,Design aircraft and spacecraft systems,Aerodynamics; CAD; Materials Science; Systems Engineering; Testing,Aerospace,High paying
511,Clinical Research Scientist,Lead clinical trials for new medical treatments,Clinical Trial Design; Statistical Analysis; Regulatory Knowledge; Medical Writing; Ethics,Healthcare,High paying
512,Quantitative Analyst,Develop mathematical models for financial trading,Mathematics; Python/R; Statistics; Risk Management; Financial Markets,Finance,High paying
513,Senior Software Architect,Design large-scale software systems and technical strategy,System Design; Architecture Patterns; Leadership; Multiple Programming Languages; Scalability,Technology,High paying
514,Data Engineering Manager,Lead teams building data infrastructure and pipelines,Data Architecture; Team Leadership; Big Data Tools; Cloud Platforms; Strategy,Technology,High paying
515,Pharmaceutical Scientist,Research and develop new drugs and medical treatments,Chemistry; Pharmacology; Clinical Research; Regulatory Affairs; Laboratory Skills,Healthcare,High paying
516,Chief Information Officer,Oversee enterprise IT strategy and digital transformation,IT Strategy; Leadership; Digital Transformation; Budgeting; Risk Management,Executive Leadership,High paying
517,Principal Consultant,Provide expert advisory services to Fortune 500 companies,Industry Expertise; Strategic Thinking; Client Management; Presentation Skills; Analytics,Consulting,High paying
518,Biomedical Engineer,Design medical devices and equipment,Engineering Design; Biology; Medical Device Regulations; CAD; Testing,Healthcare,High paying
519,Corporate Finance Director,Manage corporate financial strategy and capital allocation,Financial Planning; M&A; Capital Markets; Leadership; Strategic Analysis,Finance,High paying
520,Lead UX Researcher,Conduct user research to inform product design decisions,User Research Methods; Data Analysis; Psychology; Prototyping; Communication,Technology,High paying
521,Solutions Engineer,Provide technical expertise to support sales and implementations,Technical Sales; Problem Solving; Communication; Software Architecture; Customer Success,Technology,Average paying
522,Digital Marketing Specialist,Develop and execute digital marketing campaigns,SEO/SEM; Social Media; Analytics; Content Marketing; A/B Testing,Marketing,Average paying
523,Technical Writer,Create documentation for software and technical products,Technical Writing; Documentation Tools; Software Understanding; Communication; Research,Technology,Average paying
524,Business Intelligence Analyst,Analyze business data to support decision making,SQL; Tableau/PowerBI; Data Analysis; Business Acumen; Reporting,Business Services,Average paying
525,Scrum Master,Facilitate agile development processes and team collaboration,Agile Methodologies; Team Facilitation; Conflict Resolution; Project Management; Communication,Technology,Average paying
526,Quality Assurance Engineer,Ensure software quality through testing and validation,Test Automation; Bug Tracking; Testing Methodologies; Scripting; Attention to Detail,Technology,Average paying
527,Recruitment Specialist,Source and recruit talent for various organizational roles,Talent Acquisition; Interviewing; Networking; Communication; ATS Systems,Human Resources,Average paying
528,Financial Planner,Provide financial planning and investment advice to clients,Financial Planning; Investment Knowledge; Client Relations; Regulatory Compliance; Mathematics,Finance,Average paying
529,Operations Research Analyst,Use analytical methods to solve complex business problems,Operations Research; Statistical Analysis; Optimization; Mathematical Modeling; Programming,Business Services,Average paying
530,Environmental Consultant,Assess environmental impact and ensure regulatory compliance,Environmental Science; Regulatory Knowledge; Data Collection; Report Writing; Site Assessment,Environmental Services,Average paying
531,Instructional Designer,Design educational content and training programs,Learning Theory; Curriculum Development; E-learning Tools; Assessment Design; Communication,Education,Average paying
532,Supply Chain Analyst,Optimize supply chain operations and logistics,Supply Chain Management; Data Analysis; Forecasting; Process Improvement; ERP Systems,Logistics,Average paying
533,Market Research Analyst,Conduct market research to identify business opportunities,Market Research; Statistical Analysis; Survey Design; Data Interpretation; Presentation Skills,Marketing,Average paying
534,Systems Administrator,Maintain and troubleshoot IT infrastructure and systems,System Administration; Networking; Troubleshooting; Scripting; Security,Technology,Average paying
535,Credit Analyst,Evaluate creditworthiness of individuals and organizations,Credit Analysis; Financial Statement Analysis; Risk Assessment; Regulatory Knowledge; Attention to Detail,Finance,Average paying
536,Training Coordinator,Organize and deliver training programs for employees,Training Development; Presentation Skills; Learning Management Systems; Communication; Organization,Human Resources,Average paying
537,Database Administrator,Manage and maintain database systems and data integrity,Database Management; SQL; Backup and Recovery; Performance Tuning; Security,Technology,Average paying
538,Compliance Officer,Ensure organizational adherence to regulatory requirements,Regulatory Knowledge; Risk Assessment; Audit Skills; Communication; Attention to Detail,Legal Services,Average paying
539,User Experience Designer,Design intuitive and engaging user interfaces,UX Design; Prototyping; User Research; Visual Design; Interaction Design,Technology,Average paying
540,Social Media Manager,Manage social media presence and engagement strategies,Social Media Platforms; Content Creation; Analytics; Community Management; Brand Management,Marketing,Average paying
541,Laboratory Technician,Conduct scientific tests and experiments in laboratory settings,Laboratory Techniques; Data Collection; Scientific Equipment; Safety Protocols; Attention to Detail,Science & Research,Average paying
542,Purchasing Agent,Negotiate and manage procurement of goods and services,Negotiation; Vendor Management; Cost Analysis; Contract Management; Supply Chain Knowledge,Business Services,Average paying
543,Health Information Technician,Manage and organize healthcare data and records,Medical Coding; Health Information Systems; Data Management; Privacy Regulations; Attention to Detail,Healthcare,Average paying
544,Paralegal,Provide legal support and research assistance,Legal Research; Document Preparation; Case Management; Legal Software; Communication,Legal Services,Average paying
545,Event Coordinator,Plan and execute corporate and special events,Event Planning; Vendor Management; Budget Management; Communication; Time Management,Event Planning,Average paying
546,Graphic Designer,Create visual content for various media and platforms,Graphic Design; Adobe Creative Suite; Visual Communication; Brand Guidelines; Creativity,Creative Services,Average paying
547,Sales Development Representative,Generate leads and qualify prospects for sales team,Lead Generation; CRM Systems; Communication; Sales Process; Prospecting,Sales,Average paying
548,Manufacturing Engineer,Optimize manufacturing processes and production efficiency,Manufacturing Processes; Lean Manufacturing; CAD; Process Improvement; Quality Control,Manufacturing,Average paying
549,Tax Accountant,Prepare and file tax returns for individuals and businesses,Tax Law; Accounting Software; Attention to Detail; Analytical Skills; Communication,Finance,Average paying
550,Content Marketing Manager,Develop content strategies to drive brand awareness and engagement,Content Strategy; SEO; Analytics; Brand Management; Creative Writing,Marketing,Average paying
551,Help Desk Technician,Provide first-level technical support to end users,Technical Support; Troubleshooting; Customer Service; IT Systems; Communication,Technology,Low paying
552,Administrative Assistant,Provide administrative support to executives and teams,Office Administration; Calendar Management; Communication; Microsoft Office; Organization,Business Services,Low paying
553,Customer Service Representative,Handle customer inquiries and resolve issues,Customer Service; Communication; Problem Solving; CRM Systems; Patience,Customer Service,Low paying
554,Data Entry Clerk,Input and maintain accurate data in computer systems,Data Entry; Attention to Detail; Typing Speed; Database Software; Accuracy,Business Services,Low paying
555,Receptionist,Greet visitors and manage front desk operations,Customer Service; Phone Etiquette; Scheduling; Communication; Professional Appearance,Business Services,Low paying
556,Warehouse Associate,Handle inventory management and order fulfillment,Inventory Management; Physical Stamina; Attention to Detail; Warehouse Management Systems; Safety,Warehousing,Low paying
557,Retail Sales Associate,Assist customers with purchases and product information,Customer Service; Sales Skills; Product Knowledge; Cash Handling; Communication,Retail,Low paying
