ID_num,job_title,Short_description,Skills_required,Industry,Pay_grade
1,Software Engineer,Develop and maintain web applications using modern frameworks,Problem Solving Logical Reasoning Attention to Detail Team Collaboration Critical Thinking,Technology,High paying
2,Data Scientist,Analyze large datasets to extract business insights and build predictive models,Analytical Thinking Pattern Recognition Mathematical Reasoning Problem Solving Research Skills,Technology,High paying
3,Marketing Manager,Lead marketing campaigns and brand strategy development,Creative Thinking Strategic Planning Communication Leadership Project Management,Marketing,Average paying
4,UX Designer,Design user-friendly interfaces and improve user experience,Creative Problem Solving Empathy Research Skills Visual Thinking User-Centered Design,Technology,Average paying
5,Financial Analyst,Analyze financial data and prepare reports for investment decisions,Analytical Thinking Attention to Detail Mathematical Reasoning Critical Thinking Report Writing,Finance,Average paying
6,Project Manager,Coordinate cross-functional teams to deliver projects on time and budget,Leadership Organization Time Management Communication Risk Assessment,Business Services,Average paying
7,Sales Representative,Generate leads and close deals with potential customers,Persuasion Communication Relationship Building Resilience Goal Orientation,Sales,Average paying
8,HR Specialist,Manage recruitment processes and employee relations,Interpersonal Skills Communication Conflict Resolution Organizational Skills Discretion,Human Resources,Average paying
9,Graphic Designer,Create visual content for marketing materials and brand assets,Creativity Visual Communication Color Theory Artistic Skills Brand Awareness,Creative Services,Average paying
10,Business Analyst,Analyze business processes and recommend improvements,Analytical Thinking Process Improvement Problem Solving Communication Systems Thinking,Business Services,Average paying
11,Content Writer,Create engaging content for websites blogs and marketing materials,Creative Writing Research Skills Communication Adaptability Time Management,Media & Publishing,Average paying
12,Network Administrator,Maintain and troubleshoot computer networks and systems,Problem Solving Technical Troubleshooting Logical Reasoning Attention to Detail Patience,Technology,Average paying
13,Accountant,Prepare financial statements and manage accounting records,Mathematical Accuracy Attention to Detail Organizational Skills Analytical Thinking Ethics,Finance,Average paying
14,Customer Service Representative,Provide support to customers via phone email and chat,Active Listening Patience Problem Solving Communication Empathy,Customer Service,Low paying
15,Operations Manager,Oversee daily operations and optimize business processes,Leadership Process Improvement Decision Making Strategic Thinking Team Management,Business Services,Average paying
16,DevOps Engineer,Implement CI/CD pipelines and manage cloud infrastructure,Problem Solving Systems Thinking Automation Mindset Continuous Learning Technical Troubleshooting,Technology,High paying
17,Quality Assurance Tester,Test software applications to identify bugs and ensure quality,Attention to Detail Critical Thinking Problem Solving Patience Systematic Thinking,Technology,Average paying
18,Social Media Manager,Manage social media presence and create engaging content,Creative Thinking Trend Awareness Communication Brand Awareness Community Building,Marketing,Average paying
19,Research Scientist,Conduct scientific research and publish findings,Critical Thinking Research Skills Analytical Reasoning Persistence Scientific Writing,Research & Development,High paying
20,Legal Assistant,Support lawyers with case preparation and legal documentation,Attention to Detail Research Skills Organization Confidentiality Time Management,Legal Services,Average paying
21,Web Developer,Build and maintain websites using various programming languages,Problem Solving Creative Thinking Attention to Detail Continuous Learning Adaptability,Technology,Average paying
22,Nurse,Provide patient care in healthcare settings,Compassion Clinical Judgment Communication Attention to Detail Stress Management,Healthcare,Average paying
23,Teacher,Educate students and develop curriculum for classroom instruction,Communication Patience Creativity Organization Adaptability,Education,Average paying
24,Mechanical Engineer,Design and develop mechanical systems and products,Problem Solving Mathematical Reasoning Spatial Reasoning Critical Thinking Project Management,Engineering,High paying
25,Digital Marketing Specialist,Execute digital marketing campaigns across multiple channels,Analytical Thinking Creative Problem Solving Data Interpretation Communication Trend Awareness,Marketing,Average paying
26,Database Administrator,Manage and maintain database systems and ensure data integrity,Logical Reasoning Problem Solving Attention to Detail Systems Thinking Security Awareness,Technology,Average paying
27,Administrative Assistant,Provide administrative support to executives and teams,Organization Multitasking Communication Attention to Detail Discretion,Business Services,Low paying
28,Video Editor,Edit and produce video content for various media platforms,Creativity Attention to Detail Time Management Visual Storytelling Technical Aptitude,Media & Publishing,Average paying
29,Cybersecurity Analyst,Monitor and protect computer systems from security threats,Critical Thinking Problem Solving Attention to Detail Ethical Reasoning Continuous Learning,Technology,High paying
30,Supply Chain Coordinator,Manage inventory and coordinate logistics operations,Organization Analytical Thinking Communication Problem Solving Time Management,Logistics,Average paying
31,Mobile App Developer,Develop mobile applications for iOS and Android platforms,Problem Solving Logical Reasoning User Experience Design Attention to Detail Innovation,Technology,High paying
32,Interior Designer,Design interior spaces for residential and commercial properties,Creativity Spatial Reasoning Communication Client Relations Project Management,Design Services,Average paying
33,Electrical Engineer,Design electrical systems and troubleshoot electrical problems,Problem Solving Mathematical Reasoning Safety Awareness Attention to Detail Critical Thinking,Engineering,High paying
34,Marketing Coordinator,Support marketing initiatives and coordinate promotional activities,Organization Communication Creative Thinking Time Management Attention to Detail,Marketing,Low paying
35,Technical Writer,Create technical documentation and user manuals,Communication Clarity Logical Organization Research Skills Attention to Detail,Media & Publishing,Average paying
36,Pharmacist,Dispense medications and provide pharmaceutical care to patients,Attention to Detail Communication Patient Care Scientific Knowledge Ethical Reasoning,Healthcare,High paying
37,Product Manager,Define product strategy and coordinate product development,Strategic Thinking Leadership Communication Market Awareness Decision Making,Technology,High paying
38,Event Planner,Plan and coordinate events from conception to execution,Organization Time Management Communication Problem Solving Attention to Detail,Hospitality,Average paying
39,Speech Therapist,Provide therapy services to patients with communication disorders,Patience Communication Assessment Skills Empathy Problem Solving,Healthcare,Average paying
40,Civil Engineer,Design and supervise construction of infrastructure projects,Problem Solving Mathematical Reasoning Safety Awareness Project Management Critical Thinking,Engineering,High paying
41,SEO Specialist,Optimize websites to improve search engine rankings,Analytical Thinking Research Skills Attention to Detail Strategic Thinking Continuous Learning,Marketing,Average paying
42,Physical Therapist,Provide rehabilitation services to patients with injuries,Empathy Physical Assessment Communication Patience Problem Solving,Healthcare,High paying
43,Investment Advisor,Provide financial advice and investment recommendations to clients,Analytical Thinking Communication Risk Assessment Trust Building Financial Acumen,Finance,High paying
44,Veterinarian,Provide medical care to animals and educate pet owners,Compassion Problem Solving Communication Scientific Knowledge Stress Management,Healthcare,High paying
45,Real Estate Agent,Help clients buy sell and rent properties,Communication Negotiation Market Knowledge Relationship Building Persistence,Real Estate,Average paying
46,Chef,Prepare meals and manage kitchen operations,Creativity Time Management Leadership Attention to Detail Stress Management,Food Service,Average paying
47,Translator,Translate written and spoken content between languages,Language Proficiency Cultural Awareness Attention to Detail Communication Adaptability,Professional Services,Average paying
48,Architect,Design buildings and oversee construction projects,Creativity Problem Solving Spatial Reasoning Communication Project Management,Architecture,High paying
49,Occupational Therapist,Help patients develop skills for daily living activities,Empathy Problem Solving Communication Assessment Skills Patience,Healthcare,High paying
50,Construction Manager,Oversee construction projects and manage construction teams,Leadership Problem Solving Safety Awareness Time Management Communication,Construction,High paying
51,Fashion Designer,Design clothing and accessories for various markets,Creativity Trend Awareness Visual Skills Innovation Color Theory,Fashion,Average paying
52,Massage Therapist,Provide therapeutic massage services to clients,Physical Dexterity Empathy Communication Client Care Attention to Detail,Healthcare,Average paying
53,Insurance Agent,Sell insurance policies and provide customer service,Communication Persuasion Risk Assessment Trust Building Problem Solving,Insurance,Average paying
54,Dental Hygienist,Provide dental cleaning and preventive care services,Attention to Detail Patient Care Communication Manual Dexterity Safety Awareness,Healthcare,Average paying
55,Personal Trainer,Provide fitness training and exercise guidance to clients,Motivation Communication Goal Setting Safety Awareness Adaptability,Fitness & Recreation,Low paying
56,Photographer,Capture and edit photographs for various purposes,Creativity Visual Composition Attention to Detail Communication Technical Aptitude,Creative Services,Average paying
57,Landscaper,Design and maintain outdoor spaces and gardens,Creativity Physical Stamina Attention to Detail Planning Problem Solving,Landscaping,Low paying
58,Electrician,Install and repair electrical systems in buildings,Problem Solving Safety Awareness Manual Dexterity Attention to Detail Logical Reasoning,Construction,Average paying
59,Plumber,Install and repair plumbing systems and fixtures,Problem Solving Manual Dexterity Safety Awareness Attention to Detail Physical Stamina,Construction,Average paying
60,Carpenter,Build and repair wooden structures and furniture,Manual Dexterity Problem Solving Attention to Detail Spatial Reasoning Craftsmanship,Construction,Average paying
61,Auto Mechanic,Diagnose and repair automotive problems,Problem Solving Logical Reasoning Manual Dexterity Attention to Detail Continuous Learning,Automotive,Average paying
62,Hair Stylist,Provide hair cutting styling and coloring services,Creativity Communication Client Relations Manual Dexterity Trend Awareness,Personal Care,Low paying
63,Dental Assistant,Assist dentists with patient care and office procedures,Attention to Detail Patient Care Communication Organization Multitasking,Healthcare,Low paying
64,Bartender,Prepare and serve alcoholic and non-alcoholic beverages,Communication Multitasking Customer Service Memory Creativity,Food Service,Low paying
65,Security Guard,Monitor and protect property and people,Vigilance Communication Problem Solving Stress Management Physical Fitness,Security,Low paying
66,Flight Attendant,Ensure passenger safety and comfort during flights,Communication Safety Awareness Customer Service Stress Management Cultural Sensitivity,Aviation,Average paying
67,Truck Driver,Transport goods safely and efficiently over long distances,Safety Awareness Time Management Navigation Stress Management Physical Stamina,Transportation,Average paying
68,Receptionist,Greet visitors and handle phone calls and appointments,Communication Organization Multitasking Customer Service Attention to Detail,Business Services,Low paying
69,Janitor,Maintain cleanliness and sanitation of buildings,Attention to Detail Time Management Physical Stamina Safety Awareness Work Ethic,Facilities Management,Low paying
70,Cashier,Process customer transactions and provide customer service,Attention to Detail Communication Customer Service Mathematical Accuracy Multitasking,Retail,Low paying
71,Waiter,Serve food and beverages to restaurant customers,Communication Customer Service Multitasking Memory Physical Stamina,Food Service,Low paying
72,Retail Sales Associate,Assist customers and process sales transactions,Communication Customer Service Persuasion Product Knowledge Patience,Retail,Low paying
73,Library Assistant,Help patrons find resources and maintain library organization,Research Skills Communication Organization Customer Service Attention to Detail,Education,Low paying
74,Museum Curator,Manage museum collections and educational programs,Research Skills Communication Organization Cultural Awareness Project Management,Arts & Culture,Average paying
75,Park Ranger,Protect natural resources and educate visitors about parks,Communication Environmental Awareness Safety Skills Leadership Physical Fitness,Government,Average paying
76,Fire Fighter,Respond to emergency situations and provide fire suppression,Physical Fitness Teamwork Stress Management Problem Solving Safety Awareness,Public Safety,Average paying
77,Police Officer,Enforce laws and maintain public safety,Communication Problem Solving Physical Fitness Ethical Reasoning Stress Management,Public Safety,Average paying
78,Paramedic,Provide emergency medical care and transport patients,Quick Decision Making Stress Management Communication Empathy Physical Fitness,Healthcare,Average paying
79,Social Worker,Provide support services to individuals and families,Empathy Communication Problem Solving Advocacy Skills Stress Management,Social Services,Average paying
80,Psychologist,Provide mental health assessment and therapy services,Active Listening Empathy Analytical Thinking Communication Ethical Reasoning,Healthcare,High paying
81,Radiologic Technologist,Perform medical imaging procedures for diagnosis,Attention to Detail Safety Awareness Communication Technical Aptitude Patient Care,Healthcare,Average paying
82,Medical Assistant,Provide clinical and administrative support in healthcare,Multitasking Communication Organization Attention to Detail Empathy,Healthcare,Low paying
83,Laboratory Technician,Perform laboratory tests and analyze samples,Attention to Detail Safety Awareness Analytical Thinking Organization Technical Aptitude,Healthcare,Average paying
84,Pharmacist Technician,Assist pharmacists with medication preparation and inventory,Attention to Detail Organization Communication Customer Service Mathematical Accuracy,Healthcare,Low paying
85,Optician,Fit and dispense eyeglasses and contact lenses,Customer Service Attention to Detail Communication Manual Dexterity Problem Solving,Healthcare,Average paying
86,Respiratory Therapist,Provide respiratory care to patients with breathing disorders,Patient Care Communication Assessment Skills Problem Solving Stress Management,Healthcare,Average paying
87,Dietitian,Provide nutrition counseling and meal planning services,Communication Analytical Thinking Empathy Research Skills Health Awareness,Healthcare,Average paying
88,Environmental Scientist,Study environmental problems and develop solutions,Research Skills Analytical Thinking Problem Solving Communication Environmental Awareness,Environmental Services,High paying
89,Geologist,Study earth materials and processes for various applications,Research Skills Analytical Thinking Problem Solving Physical Stamina Attention to Detail,Mining & Resources,High paying
90,Meteorologist,Study weather patterns and provide weather forecasts,Analytical Thinking Pattern Recognition Communication Data Interpretation Mathematical Reasoning,Science & Research,High paying
91,Astronomer,Study celestial objects and phenomena in space,Research Skills Mathematical Reasoning Pattern Recognition Analytical Thinking Patience,Science & Research,High paying
92,Biologist,Study living organisms and biological processes,Research Skills Analytical Thinking Problem Solving Attention to Detail Scientific Writing,Science & Research,High paying
93,Chemist,Conduct chemical research and analysis for various applications,Analytical Thinking Safety Awareness Problem Solving Attention to Detail Research Skills,Science & Research,High paying
94,Physicist,Study matter energy and their interactions,Mathematical Reasoning Analytical Thinking Problem Solving Research Skills Abstract Thinking,Science & Research,High paying
95,Mathematician,Solve mathematical problems and develop mathematical theories,Logical Reasoning Abstract Thinking Problem Solving Pattern Recognition Analytical Thinking,Science & Research,High paying
96,Statistician,Analyze data and develop statistical models,Analytical Thinking Mathematical Reasoning Pattern Recognition Attention to Detail Research Skills,Science & Research,High paying
97,Economist,Study economic trends and analyze economic data,Analytical Thinking Research Skills Critical Thinking Mathematical Reasoning Communication,Economics,High paying
98,Political Scientist,Study political systems and analyze political behavior,Research Skills Analytical Thinking Critical Thinking Communication Writing Skills,Social Sciences,High paying
99,Sociologist,Study human society and social behavior,Research Skills Analytical Thinking Communication Cultural Awareness Critical Thinking,Social Sciences,High paying
100,Anthropologist,Study human culture and social organization,Research Skills Cultural Awareness Communication Analytical Thinking Adaptability,Social Sciences,High paying
101,Historian,Research and analyze historical events and trends,Research Skills Analytical Thinking Writing Skills Critical Thinking Attention to Detail,Education,Average paying
102,Journalist,Research and report news stories for various media,Research Skills Communication Writing Skills Curiosity Time Management,Media & Publishing,Average paying
103,Editor,Review and edit written content for publication,Attention to Detail Communication Writing Skills Critical Thinking Organization,Media & Publishing,Average paying
104,Public Relations Specialist,Manage public image and media relations for organizations,Communication Strategic Thinking Relationship Building Crisis Management Creativity,Marketing,Average paying
105,Advertising Executive,Develop and implement advertising campaigns,Creative Thinking Strategic Planning Communication Leadership Project Management,Advertising,High paying
106,Art Director,Oversee visual aspects of advertising and media projects,Creative Leadership Visual Communication Project Management Team Management,Advertising,High paying
107,Copywriter,Write persuasive content for advertising and marketing,Creative Writing Communication Persuasion Brand Awareness Research Skills,Advertising,Average paying
108,Film Director,Direct actors and crew in film and video production,Leadership Creative Vision Communication Project Management Decision Making,Entertainment,High paying
109,Screenwriter,Write scripts for films television and other media,Creative Writing Storytelling Research Skills Character Development Communication,Entertainment,Average paying
110,Actor,Perform roles in theatrical film and television productions,Creativity Memorization Emotional Expression Communication Adaptability,Entertainment,Average paying
111,Musician,Perform music for live audiences and recordings,Creativity Discipline Performance Skills Communication Collaboration,Entertainment,Average paying
112,Sound Engineer,Operate audio equipment for recordings and live events,Technical Aptitude Attention to Detail Problem Solving Communication Creativity,Entertainment,Average paying
113,Video Game Designer,Design gameplay mechanics and overall game experience,Creative Problem Solving Systems Thinking User Experience Design Innovation Logical Reasoning,Gaming,High paying
114,Animation Artist,Create animated sequences for films games and media,Creativity Visual Storytelling Attention to Detail Patience Technical Aptitude,Entertainment,Average paying
115,Comic Book Artist,Create artwork and illustrations for comic books,Creativity Visual Storytelling Character Development Attention to Detail Time Management,Entertainment,Average paying
116,Fashion Model,Model clothing and accessories for fashion shows and photography,Physical Fitness Professionalism Adaptability Communication Self-Discipline,Fashion,Average paying
117,Dance Instructor,Teach dance techniques and choreography to students,Physical Coordination Communication Teaching Skills Creativity Patience,Arts & Culture,Low paying
118,Yoga Instructor,Lead yoga classes and provide instruction in yoga practices,Physical Fitness Communication Teaching Skills Mindfulness Empathy,Fitness & Recreation,Low paying
119,Sports Coach,Train athletes and develop game strategies,Leadership Communication Motivation Strategic Thinking Physical Fitness,Sports,Average paying
120,Athletic Trainer,Provide injury prevention and treatment for athletes,Physical Assessment Communication Problem Solving Safety Awareness Empathy,Sports,Average paying
121,Recreation Coordinator,Plan and organize recreational activities and programs,Organization Communication Leadership Time Management Creativity,Recreation,Average paying
122,Camp Counselor,Supervise and lead activities for children at camps,Communication Patience Leadership Safety Awareness Creativity,Recreation,Low paying
123,Cruise Director,Organize entertainment and activities for cruise passengers,Communication Leadership Entertainment Skills Organization Customer Service,Hospitality,Average paying
124,Travel Agent,Plan and book travel arrangements for clients,Customer Service Organization Communication Research Skills Problem Solving,Travel & Tourism,Average paying
125,Hotel Manager,Oversee hotel operations and ensure guest satisfaction,Leadership Customer Service Problem Solving Financial Management Communication,Hospitality,Average paying
126,Restaurant Manager,Manage restaurant operations and staff,Leadership Communication Customer Service Problem Solving Time Management,Food Service,Average paying
127,Catering Manager,Plan and coordinate catering events and services,Organization Leadership Communication Time Management Customer Service,Food Service,Average paying
128,Wedding Planner,Plan and coordinate wedding ceremonies and receptions,Organization Communication Attention to Detail Time Management Customer Service,Event Planning,Average paying
129,Florist,Design and arrange flowers for various occasions,Creativity Color Theory Customer Service Manual Dexterity Attention to Detail,Retail,Low paying
130,Baker,Bake bread pastries and other baked goods,Attention to Detail Time Management Creativity Safety Awareness Quality Control,Food Service,Low paying
131,Butcher,Cut and prepare meat products for sale,Manual Dexterity Safety Awareness Customer Service Attention to Detail Product Knowledge,Food Service,Low paying
132,Farmer,Grow crops and raise livestock for food production,Physical Stamina Problem Solving Environmental Awareness Time Management Planning,Agriculture,Low paying
133,Fisherman,Catch fish and other seafood for commercial purposes,Physical Stamina Safety Awareness Navigation Problem Solving Environmental Awareness,Agriculture,Low paying
134,Logger,Harvest timber from forests for commercial use,Physical Stamina Safety Awareness Environmental Awareness Equipment Operation Teamwork,Forestry,Average paying
135,Miner,Extract minerals and resources from underground mines,Physical Stamina Safety Awareness Attention to Detail Teamwork Problem Solving,Mining & Resources,Average paying
136,Oil Rig Worker,Operate equipment on offshore oil drilling platforms,Physical Stamina Safety Awareness Teamwork Problem Solving Stress Management,Oil & Gas,High paying
137,Solar Panel Installer,Install and maintain solar energy systems,Safety Awareness Manual Dexterity Problem Solving Physical Fitness Environmental Awareness,Renewable Energy,Average paying
138,Wind Turbine Technician,Maintain and repair wind energy equipment,Safety Awareness Physical Fitness Problem Solving Manual Dexterity Environmental Awareness,Renewable Energy,Average paying
139,HVAC Technician,Install and repair heating ventilation and air conditioning systems,Problem Solving Manual Dexterity Safety Awareness Attention to Detail Customer Service,Construction,Average paying
140,Locksmith,Install and repair locks and security systems,Problem Solving Manual Dexterity Attention to Detail Customer Service Security Awareness,Security,Average paying
141,Watchmaker,Repair and maintain timepieces and clocks,Manual Dexterity Attention to Detail Patience Problem Solving Precision,Specialized Services,Average paying
142,Jeweler,Design and repair jewelry and precious items,Manual Dexterity Creativity Attention to Detail Customer Service Visual Skills,Retail,Average paying
143,Tailor,Alter and create custom clothing and garments,Manual Dexterity Attention to Detail Customer Service Problem Solving Creativity,Personal Services,Low paying
144,Cobbler,Repair and restore shoes and leather goods,Manual Dexterity Problem Solving Attention to Detail Customer Service Craftsmanship,Personal Services,Low paying
