ID_num,job_title,Short_description,Skills_required,Industry,Pay_grade
558,Food Service Worker,Prepare and serve food in restaurant or cafeteria settings,Food Preparation; Customer Service; Sanitation; Teamwork; Physical Stamina,Food Service,Low paying
559,Security Guard,Monitor premises and ensure safety and security,Security Procedures; Observation Skills; Communication; Physical Fitness; Emergency Response,Security,Low paying
560,Janitor,Maintain cleanliness and sanitation of facilities,Cleaning Techniques; Equipment Operation; Attention to Detail; Physical Stamina; Time Management,Cleaning Services,Low paying
561,Delivery Driver,Transport goods and packages to customers,Driving Skills; Navigation; Customer Service; Time Management; Physical Stamina,Transportation,Low paying
562,Cashier,Process customer transactions and handle payments,Cash Handling; Customer Service; Attention to Detail; Point of Sale Systems; Mathematics,Retail,Low paying
563,Maintenance Worker,Perform routine maintenance and repairs on facilities,Maintenance Skills; Tool Usage; Problem Solving; Safety Protocols; Physical Skills,Maintenance Services,Low paying
564,Landscaping Worker,Maintain and beautify outdoor spaces and gardens,Landscaping; Plant Knowledge; Equipment Operation; Physical Stamina; Attention to Detail,Landscaping,Low paying
565,Kitchen Assistant,Support kitchen operations in food service establishments,Food Preparation; Sanitation; Teamwork; Physical Stamina; Following Instructions,Food Service,Low paying
566,Parking Attendant,Manage parking facilities and assist customers,Customer Service; Cash Handling; Attention to Detail; Physical Activity; Communication,Facilities Management,Low paying
567,Farm Worker,Perform agricultural tasks and crop maintenance,Agricultural Skills; Physical Stamina; Equipment Operation; Seasonal Work; Attention to Detail,Agriculture,Low paying
568,Housekeeping Aide,Clean and maintain residential or commercial properties,Cleaning Skills; Attention to Detail; Time Management; Physical Stamina; Reliability,Cleaning Services,Low paying
569,Library Assistant,Support library operations and help patrons,Customer Service; Organization; Computer Skills; Attention to Detail; Communication,Education,Low paying
570,Assembly Line Worker,Assemble products on manufacturing production lines,Manual Dexterity; Attention to Detail; Teamwork; Physical Stamina; Quality Control,Manufacturing,Low paying
571,Childcare Worker,Supervise and care for children in daycare settings,Child Development; Patience; Communication; Safety Awareness; Creativity,Education,Low paying
572,Dog Walker,Provide exercise and care services for pets,Animal Handling; Physical Fitness; Reliability; Love for Animals; Communication,Pet Services,Low paying
573,Dishwasher,Clean dishes and maintain kitchen sanitation,Sanitation; Physical Stamina; Teamwork; Attention to Detail; Following Instructions,Food Service,Low paying
574,Hotel Housekeeper,Clean and maintain hotel rooms and facilities,Cleaning Skills; Attention to Detail; Time Management; Physical Stamina; Hospitality,Hospitality,Low paying
575,Telemarketer,Make outbound calls to promote products or services,Communication; Persistence; Sales Skills; Computer Skills; Stress Management,Sales,Low paying
576,Product Manager,Define product strategy and coordinate development teams,Product Management; Market Research; Stakeholder Management; Analytics; Strategic Thinking,Technology,High paying
577,Principal Data Scientist,Lead data science initiatives and advanced analytics projects,Advanced Statistics; Machine Learning; Team Leadership; Business Strategy; Python/R,Technology,High paying
578,Senior DevOps Engineer,Design and implement CI/CD pipelines and infrastructure automation,DevOps; Kubernetes; Cloud Platforms; Infrastructure as Code; Automation,Technology,High paying
579,Enterprise Architect,Design enterprise-wide technology architecture and standards,Enterprise Architecture; System Integration; Technology Strategy; Leadership; Communication,Technology,High paying
580,Chief Marketing Officer,Develop and execute comprehensive marketing strategies,Marketing Strategy; Brand Management; Digital Marketing; Team Leadership; Analytics,Executive Leadership,High paying
581,Investment Manager,Manage investment portfolios and client relationships,Portfolio Management; Financial Analysis; Risk Management; Client Relations; Market Knowledge,Finance,High paying
582,Cardiologist,Diagnose and treat heart and cardiovascular conditions,Medical Expertise; Diagnostic Skills; Patient Care; Surgical Skills; Continuous Learning,Healthcare,High paying
583,Patent Attorney,Provide legal counsel on intellectual property matters,Patent Law; Technical Knowledge; Legal Research; Writing Skills; Analytical Thinking,Legal Services,High paying
584,Principal Software Engineer,Lead complex software development projects and technical decisions,Advanced Programming; System Design; Technical Leadership; Code Review; Mentoring,Technology,High paying
585,Head of Product,Oversee product portfolio and strategic product direction,Product Strategy; Market Analysis; Team Leadership; Stakeholder Management; Innovation,Technology,High paying
586,Senior Management Consultant,Advise executives on strategic business transformations,Strategic Analysis; Change Management; Client Management; Industry Expertise; Leadership,Consulting,High paying
587,Chief Data Officer,Lead enterprise data strategy and governance initiatives,Data Strategy; Data Governance; Analytics; Leadership; Digital Transformation,Executive Leadership,High paying
588,Interventional Radiologist,Perform minimally invasive medical procedures using imaging guidance,Medical Imaging; Surgical Skills; Patient Care; Technical Expertise; Precision,Healthcare,High paying
589,Hedge Fund Manager,Manage investment funds and trading strategies,Investment Strategy; Risk Management; Financial Markets; Quantitative Analysis; Leadership,Finance,High paying
590,VP of Engineering,Lead engineering organizations and technical strategy,Engineering Leadership; Technical Strategy; Team Building; Product Development; Innovation,Technology,High paying
591,Senior Business Analyst,Analyze business processes and recommend improvements,Business Analysis; Process Modeling; Stakeholder Management; Requirements Gathering; Communication,Business Services,Average paying
592,Marketing Automation Specialist,Implement and manage marketing automation campaigns,Marketing Automation; Email Marketing; CRM Systems; Analytics; Campaign Management,Marketing,Average paying
593,Technical Support Engineer,Provide advanced technical support for software products,Technical Troubleshooting; Customer Service; Software Knowledge; Communication; Problem Solving,Technology,Average paying
594,Operations Coordinator,Coordinate operational activities and process improvements,Operations Management; Project Coordination; Process Improvement; Communication; Organization,Business Services,Average paying
595,HR Business Partner,Provide strategic HR support to business units,HR Strategy; Employee Relations; Talent Management; Business Acumen; Communication,Human Resources,Average paying
596,Financial Controller,Oversee financial reporting and accounting operations,Financial Reporting; Accounting Standards; Team Management; Budgeting; Compliance,Finance,Average paying
597,Product Marketing Manager,Develop go-to-market strategies for products,Product Marketing; Market Research; Competitive Analysis; Campaign Management; Communication,Marketing,Average paying
598,Site Reliability Engineer,Ensure reliability and performance of production systems,System Reliability; Monitoring; Automation; Incident Response; Performance Optimization,Technology,Average paying
599,Learning and Development Specialist,Design and deliver employee training programs,Training Design; Adult Learning; Facilitation; LMS Administration; Assessment,Human Resources,Average paying
600,Business Development Manager,Identify and pursue new business opportunities,Business Development; Sales Strategy; Relationship Building; Market Analysis; Negotiation,Sales,Average paying
601,Junior Software Developer,Develop software applications under senior guidance,Programming; Debugging; Version Control; Testing; Learning Agility,Technology,Average paying
602,Marketing Coordinator,Support marketing campaigns and activities,Marketing Support; Content Creation; Social Media; Event Coordination; Communication,Marketing,Average paying
603,Accounts Receivable Specialist,Manage customer billing and payment collection,Accounts Receivable; Billing Systems; Customer Service; Attention to Detail; Communication,Finance,Average paying
604,IT Support Specialist,Provide technical support for hardware and software issues,IT Support; Hardware Troubleshooting; Software Installation; Customer Service; Documentation,Technology,Average paying
605,Logistics Coordinator,Coordinate shipments and supply chain activities,Logistics; Inventory Management; Communication; Organization; Problem Solving,Logistics,Average paying
606,Junior Graphic Designer,Create visual designs for various marketing materials,Graphic Design; Adobe Creative Suite; Brand Guidelines; Creativity; Time Management,Creative Services,Average paying
607,Customer Success Manager,Ensure customer satisfaction and retention,Customer Success; Relationship Management; Product Knowledge; Communication; Problem Solving,Business Services,Average paying
608,Payroll Specialist,Process payroll and maintain employee compensation records,Payroll Processing; Payroll Software; Attention to Detail; Confidentiality; Compliance,Human Resources,Average paying
609,Research Assistant,Support research projects and data collection activities,Research Methods; Data Collection; Literature Review; Analytical Skills; Organization,Science & Research,Average paying
610,Junior Accountant,Assist with accounting tasks and financial record keeping,Accounting; Financial Reporting; Bookkeeping; Attention to Detail; Analytical Skills,Finance,Average paying
611,Social Worker,Provide support services to individuals and families in need,Social Work; Case Management; Counseling; Advocacy; Empathy,Social Services,Average paying
612,Occupational Therapist,Help patients develop or recover daily living skills,Occupational Therapy; Patient Assessment; Treatment Planning; Rehabilitation; Empathy,Healthcare,Average paying
613,Physical Therapist,Provide rehabilitation services for patients with physical injuries,Physical Therapy; Anatomy; Exercise Prescription; Patient Care; Manual Therapy,Healthcare,Average paying
614,Dental Hygienist,Provide preventive dental care and patient education,Dental Hygiene; Patient Care; Dental Equipment; Health Education; Attention to Detail,Healthcare,Average paying
615,Registered Nurse,Provide direct patient care in healthcare settings,Nursing; Patient Care; Medical Procedures; Documentation; Empathy,Healthcare,Average paying
616,Elementary School Teacher,Educate and nurture young students in elementary grades,Teaching; Curriculum Development; Classroom Management; Child Development; Patience,Education,Average paying
617,High School Teacher,Educate students in specific subject areas,Subject Matter Expertise; Teaching; Lesson Planning; Classroom Management; Communication,Education,Average paying
618,Librarian,Manage library resources and assist patrons with information needs,Library Science; Information Management; Research Skills; Customer Service; Organization,Education,Average paying
619,Mental Health Counselor,Provide counseling services to individuals with mental health issues,Counseling; Psychology; Active Listening; Empathy; Treatment Planning,Healthcare,Average paying
620,Veterinary Technician,Assist veterinarians with animal care and medical procedures,Veterinary Medicine; Animal Handling; Medical Equipment; Patient Care; Attention to Detail,Animal Services,Average paying
621,File Clerk,Organize and maintain filing systems and records,Filing Systems; Organization; Attention to Detail; Data Entry; Record Keeping,Business Services,Low paying
622,Ticket Taker,Collect tickets and direct patrons at entertainment venues,Customer Service; Crowd Management; Attention to Detail; Communication; Standing,Entertainment,Low paying
623,Concession Stand Worker,Sell food and beverages at entertainment venues,Food Service; Cash Handling; Customer Service; Inventory Management; Teamwork,Food Service,Low paying
624,Usher,Guide and assist patrons at theaters and entertainment venues,Customer Service; Crowd Management; Communication; Physical Activity; Attention to Detail,Entertainment,Low paying
625,Groundskeeper,Maintain outdoor grounds and facilities,Landscaping; Equipment Operation; Physical Labor; Attention to Detail; Weather Tolerance,Landscaping,Low paying
626,Laundry Attendant,Operate laundry equipment and fold clothing,Laundry Operations; Equipment Operation; Attention to Detail; Physical Stamina; Time Management,Personal Services,Low paying
627,Car Wash Attendant,Clean vehicles using various cleaning techniques,Vehicle Cleaning; Physical Labor; Attention to Detail; Customer Service; Teamwork,Automotive,Low paying
628,Grocery Store Clerk,Stock shelves and assist customers in grocery stores,Inventory Management; Customer Service; Physical Labor; Attention to Detail; Teamwork,Retail,Low paying
629,Fast Food Worker,Prepare and serve food in fast-food restaurants,Food Preparation; Customer Service; Speed; Teamwork; Sanitation,Food Service,Low paying
630,Movie Theater Attendant,Assist customers and maintain theater facilities,Customer Service; Cleaning; Crowd Management; Communication; Physical Activity,Entertainment,Low paying
631,Newspaper Delivery,Deliver newspapers to subscribers,Driving/Cycling; Route Management; Time Management; Physical Activity; Reliability,Media & Publishing,Low paying
632,Pet Groomer,Provide grooming services for pets,Animal Handling; Grooming Techniques; Customer Service; Patience; Physical Stamina,Pet Services,Low paying
633,Furniture Mover,Transport furniture and household items,Physical Strength; Lifting Techniques; Customer Service; Teamwork; Problem Solving,Moving Services,Low paying
634,Valet Parking Attendant,Park and retrieve vehicles for customers,Driving Skills; Customer Service; Physical Activity; Attention to Detail; Time Management,Hospitality,Low paying
635,Tour Guide,Lead tours and provide information to visitors,Public Speaking; Local Knowledge; Customer Service; Communication; Walking/Standing,Tourism,Low paying
636,Amusement Park Attendant,Operate rides and assist guests at amusement parks,Safety Procedures; Customer Service; Equipment Operation; Physical Activity; Attention to Detail,Recreation,Low paying
637,Golf Course Maintenance,Maintain golf course grounds and facilities,Landscaping; Equipment Operation; Physical Labor; Attention to Detail; Early Hours,Recreation,Low paying
638,Lifeguard,Monitor swimming areas and ensure safety of swimmers,Swimming Skills; CPR/First Aid; Safety Awareness; Physical Fitness; Vigilance,Recreation,Low paying
639,Ski Lift Operator,Operate ski lifts and assist skiers,Equipment Operation; Customer Service; Safety Procedures; Physical Activity; Weather Tolerance,Recreation,Low paying
640,Boat Rental Attendant,Rent boats and provide safety instructions,Boating Knowledge; Customer Service; Safety Procedures; Physical Activity; Communication,Recreation,Low paying
641,Senior Quality Engineer,Lead quality assurance programs and process improvements,Quality Management; Statistical Analysis; Process Improvement; Leadership; Compliance,Manufacturing,High paying
642,Director of Operations,Oversee operational excellence and strategic initiatives,Operations Management; Strategic Planning; Leadership; Process Optimization; P&L Management,Business Services,High paying
643,Principal UX Designer,Lead user experience design for complex digital products,UX Design; Design Systems; User Research; Prototyping; Design Leadership,Technology,High paying
644,Senior Research Scientist,Conduct advanced research and lead scientific projects,Research Methodology; Scientific Analysis; Grant Writing; Team Leadership; Publication,Science & Research,High paying
645,Chief Technology Officer,Define technology vision and lead engineering organizations,Technology Strategy; Engineering Leadership; Innovation; Digital Transformation; Executive Management,Executive Leadership,High paying
646,Investment Banking Director,Lead M&A transactions and client relationships,Corporate Finance; Deal Structuring; Client Management; Team Leadership; Financial Modeling,Finance,High paying
647,Chief Operating Officer,Oversee all operational aspects of the organization,Operations Strategy; Executive Leadership; Process Optimization; Change Management; P&L Management,Executive Leadership,High paying
648,Senior Tax Manager,Manage complex tax planning and compliance for corporations,Tax Strategy; Corporate Tax; Regulatory Compliance; Team Leadership; Financial Planning,Finance,High paying
649,Principal Solutions Architect,Design enterprise-level technical solutions,Solution Architecture; Technical Leadership; Client Consulting; System Integration; Innovation,Technology,High paying
650,VP of Sales,Lead sales organization and revenue growth strategies,Sales Leadership; Revenue Strategy; Team Building; Market Development; Executive Presence,Sales,High paying
651,Digital Product Manager,Manage digital product development and user experience,Product Management; Digital Strategy; User Experience; Agile Development; Analytics,Technology,Average paying
652,Brand Manager,Develop and execute brand strategies and campaigns,Brand Management; Marketing Strategy; Campaign Development; Market Research; Creative Direction,Marketing,Average paying
653,Compensation Analyst,Analyze and design employee compensation programs,Compensation Analysis; HR Analytics; Market Research; Statistical Analysis; Excel,Human Resources,Average paying
654,Network Engineer,Design and maintain network infrastructure,Network Engineering; Cisco Technologies; Troubleshooting; Security; Documentation,Technology,Average paying
655,Training Manager,Develop and oversee organizational training programs,Training Management; Curriculum Development; Adult Learning; Team Leadership; Assessment,Human Resources,Average paying
656,Business Operations Analyst,Analyze business operations and recommend improvements,Operations Analysis; Process Mapping; Data Analysis; Project Management; Communication,Business Services,Average paying
657,Email Marketing Specialist,Develop and execute email marketing campaigns,Email Marketing; Marketing Automation; A/B Testing; Analytics; Creative Writing,Marketing,Average paying
658,Application Support Analyst,Provide support for business applications and systems,Application Support; Troubleshooting; SQL; Business Analysis; Customer Service,Technology,Average paying
659,Budget Analyst,Analyze budgets and financial planning for organizations,Budget Analysis; Financial Planning; Excel; Cost Analysis; Forecasting,Finance,Average paying
660,Facilities Manager,Manage building operations and maintenance,Facilities Management; Vendor Management; Maintenance Planning; Budgeting; Safety Compliance,Facilities Management,Average paying
661,Junior Marketing Assistant,Support marketing activities and campaigns,Marketing Support; Social Media; Content Creation; Administrative Tasks; Communication,Marketing,Low paying
662,Office Assistant,Provide general administrative support to office staff,Administrative Support; Filing; Phone Answering; Data Entry; Customer Service,Business Services,Low paying
663,Inventory Clerk,Track and manage inventory levels and stock movements,Inventory Management; Data Entry; Attention to Detail; Computer Skills; Organization,Warehousing,Low paying
664,Mail Clerk,Sort and distribute mail within organization,Mail Sorting; Organization; Attention to Detail; Physical Activity; Time Management,Postal Services,Low paying
665,Copy Machine Operator,Operate copy machines and handle print requests,Equipment Operation; Attention to Detail; Customer Service; Organization; Basic Maintenance,Business Services,Low paying
666,Parking Meter Attendant,Monitor parking meters and issue citations,Enforcement; Walking; Attention to Detail; Customer Service; Record Keeping,Government,Low paying
667,Survey Taker,Conduct surveys and collect data from respondents,Data Collection; Communication; Attention to Detail; Patience; Computer Skills,Research & Development,Low paying
668,Telemarketing Assistant,Make calls to promote products or gather information,Communication; Phone Skills; Data Entry; Persistence; Customer Service,Sales,Low paying
669,Cleaning Service Worker,Clean offices and commercial buildings,Cleaning Techniques; Attention to Detail; Physical Stamina; Time Management; Reliability,Cleaning Services,Low paying
670,Landscape Laborer,Perform basic landscaping tasks and maintenance,Physical Labor; Basic Landscaping; Equipment Use; Teamwork; Weather Tolerance,Landscaping,Low paying
671,Construction Laborer,Assist with construction projects and manual labor,Physical Labor; Construction Safety; Tool Usage; Teamwork; Following Instructions,Construction,Low paying
672,Kitchen Prep Cook,Prepare ingredients and assist with food preparation,Food Preparation; Kitchen Safety; Sanitation; Teamwork; Time Management,Food Service,Low paying
673,Dishwasher/Busser,Clean dishes and maintain dining area cleanliness,Cleaning; Physical Stamina; Teamwork; Time Management; Attention to Detail,Food Service,Low paying
674,Retail Stock Clerk,Receive and stock merchandise in retail stores,Inventory Management; Physical Labor; Attention to Detail; Organization; Teamwork,Retail,Low paying
675,Gas Station Attendant,Assist customers with fuel and vehicle services,Customer Service; Cash Handling; Basic Automotive; Attention to Detail; Physical Activity,Automotive,Low paying
676,Animal Kennel Worker,Care for animals in kennels and shelters,Animal Care; Cleaning; Physical Stamina; Patience; Attention to Detail,Animal Services,Low paying
677,Recycling Worker,Sort and process recyclable materials,Sorting; Physical Labor; Attention to Detail; Environmental Awareness; Teamwork,Environmental Services,Low paying
678,Sign Holder,Hold advertising signs to promote businesses,Physical Stamina; Weather Tolerance; Reliability; Attention to Detail; Customer Interaction,Advertising,Low paying
679,Leaflet Distributor,Distribute flyers and promotional materials,Physical Activity; Customer Interaction; Reliability; Time Management; Communication,Advertising,Low paying
680,Event Setup Worker,Set up equipment and decorations for events,Physical Labor; Attention to Detail; Teamwork; Time Management; Following Instructions,Event Planning,Low paying
681,Senior VP of Technology,Lead technology transformation and innovation initiatives,Technology Leadership; Digital Transformation; Strategic Planning; Innovation Management; Executive Leadership,Executive Leadership,High paying
682,Chief Revenue Officer,Drive revenue growth and go-to-market strategies,Revenue Strategy; Sales Leadership; Market Development; Strategic Partnerships; Executive Management,Executive Leadership,High paying
683,Principal Engineer,Lead engineering excellence and technical innovation,Technical Leadership; Engineering Excellence; System Architecture; Mentoring; Innovation,Technology,High paying
684,VP of Product Management,Oversee product portfolio and strategic roadmap,Product Strategy; Portfolio Management; Market Analysis; Leadership; Innovation,Technology,High paying
685,Head of Data Science,Lead data science organization and AI initiatives,Data Science Leadership; Machine Learning; AI Strategy; Team Building; Advanced Analytics,Technology,High paying
686,Managing Director,Lead business unit operations and strategic growth,Business Leadership; Strategic Planning; P&L Management; Team Building; Market Development,Executive Leadership,High paying
687,Chief Financial Officer,Oversee financial strategy and corporate finance,Financial Strategy; Corporate Finance; Risk Management; Executive Leadership; Investor Relations,Executive Leadership,High paying
688,Senior Vice President,Lead major business divisions and strategic initiatives,Executive Leadership; Strategic Planning; Business Development; Team Management; Market Strategy,Executive Leadership,High paying
689,General Manager,Manage overall business operations and performance,Operations Management; Business Strategy; Team Leadership; P&L Responsibility; Customer Relations,Executive Leadership,High paying
690,Director of Engineering,Lead engineering teams and technical delivery,Engineering Management; Technical Strategy; Team Building; Product Development; Innovation,Technology,High paying
691,Corporate Development Manager,Lead M&A activities and strategic partnerships,Corporate Development; Financial Analysis; Deal Structuring; Due Diligence; Negotiation,Finance,Average paying
692,Regional Sales Manager,Manage sales operations across geographic regions,Sales Management; Territory Management; Team Leadership; Customer Relations; Revenue Growth,Sales,Average paying
693,Product Operations Manager,Optimize product development processes and workflows,Product Operations; Process Improvement; Cross-functional Collaboration; Analytics; Project Management,Technology,Average paying
694,Customer Experience Manager,Design and improve customer journey and satisfaction,Customer Experience; Journey Mapping; Analytics; Process Improvement; Stakeholder Management,Business Services,Average paying
695,Revenue Operations Analyst,Analyze and optimize revenue processes and systems,Revenue Operations; Sales Analytics; CRM Management; Process Optimization; Data Analysis,Business Services,Average paying
